PMID,Title,Authors,Citation,First Author,Journal/Book,Publication Year,Create Date,PMCID,NIHMS ID,DOI
"29523137","Antibody levels to recombinant VAR2CSA domains vary with Plasmodium falciparum parasitaemia, gestational age, and gravidity, but do not predict pregnancy outcomes","Fried M, Kurtis JD, Swihart B, Morrison R, Pond-Tor S, Barry A, Sidibe Y, Keita S, Mahamar A, Andemel N, Attaher O, Dembele AB, Cisse KB, Diarra BS, Kanoute MB, Narum DL, Dicko A, Duffy PE.","Malar J. 2018 Mar 9;17(1):106. doi: 10.1186/s12936-018-2258-9.","Fried M","Malar J","2018","2018/03/11","PMC5845157","","10.1186/s12936-018-2258-9"
"21544923","Toxicologic and immunologic effects of perinatal exposure to the brominated diphenyl ether (BDE) mixture DE-71 in the Sprague-Dawley rat","Bondy GS, Lefebvre DE, Aziz S, Cherry W, Coady L, Maclellan E, Armstrong C, Barker M, Cooke G, Gaertner D, Arnold DL, Mehta R, Rowsell PR.","Environ Toxicol. 2013 Apr;28(4):215-28. doi: 10.1002/tox.20713. Epub 2011 May 4.","Bondy GS","Environ Toxicol","2013","2011/05/06","","","10.1002/tox.20713"
"25724818","Toxicological assessments of rats exposed prenatally to inhaled vapors of gasoline and gasoline-ethanol blends","Bushnell PJ, Beasley TE, Evansky PA, Martin SA, McDaniel KL, Moser VC, Luebke RW, Norwood J Jr, Copeland CB, Kleindienst TE, Lonneman WA, Rogers JM.","Neurotoxicol Teratol. 2015 May-Jun;49:19-30. doi: 10.1016/j.ntt.2015.02.004. Epub 2015 Feb 24.","Bushnell PJ","Neurotoxicol Teratol","2015","2015/03/01","","","10.1016/j.ntt.2015.02.004"
"29254235","Prednisone may induce immunologic tolerance by activating the functions of decidual immune cells in early pregnancy","Fu XQ, Cai JY, Huang QY, Li DJ, Li N, Li MJ.","Oncotarget. 2017 Oct 31;8(60):102191-102198. doi: 10.18632/oncotarget.22188. eCollection 2017 Nov 24.","Fu XQ","Oncotarget","2017","2017/12/20","PMC5731945","","10.18632/oncotarget.22188"
"35353543","Inflammatory blockade prevents injury to the developing pulmonary gas exchange surface in preterm primates","Toth A, Steinmeyer S, Kannan P, Gray J, Jackson CM, Mukherjee S, Demmert M, Sheak JR, Benson D, Kitzmiller J, Wayman JA, Presicce P, Cates C, Rubin R, Chetal K, Du Y, Miao Y, Gu M, Guo M, Kalinichenko VV, Kallapur SG, Miraldi ER, Xu Y, Swarr D, Lewkowich I, Salomonis N, Miller L, Sucre JS, Whitsett JA, Chougnet CA, Jobe AH, Deshmukh H, Zacharias WJ.","Sci Transl Med. 2022 Mar 30;14(638):eabl8574. doi: 10.1126/scitranslmed.abl8574. Epub 2022 Mar 30.","Toth A","Sci Transl Med","2022","2022/03/30","PMC9082785","NIHMS1801228","10.1126/scitranslmed.abl8574"
"32130900","The Interplay between CD27(dull) and CD27(bright) B Cells Ensures the Flexibility, Stability, and Resilience of Human B Cell Memory","Grimsholm O, Piano Mortari E, Davydov AN, Shugay M, Obraztsova AS, Bocci C, Marasco E, Marcellini V, Aranburu A, Farroni C, Silvestris DA, Cristofoletti C, Giorda E, Scarsella M, Cascioli S, Barresi S, Lougaris V, Plebani A, Cancrini C, Finocchi A, Moschese V, Valentini D, Vallone C, Signore F, de Vincentiis G, Zaffina S, Russo G, Gallo A, Locatelli F, Tozzi AE, Tartaglia M, Chudakov DM, Carsetti R.","Cell Rep. 2020 Mar 3;30(9):2963-2977.e6. doi: 10.1016/j.celrep.2020.02.022.","Grimsholm O","Cell Rep","2020","2020/03/05","","","10.1016/j.celrep.2020.02.022"
"25381448","Hyperimmune bovine colostrum as a novel therapy to combat Clostridium difficile infection","Sponseller JK, Steele JA, Schmidt DJ, Kim HB, Beamer G, Sun X, Tzipori S.","J Infect Dis. 2015 Apr 15;211(8):1334-41. doi: 10.1093/infdis/jiu605. Epub 2014 Nov 7.","Sponseller JK","J Infect Dis","2015","2014/11/09","PMC4447838","","10.1093/infdis/jiu605"
"29062585","Fetal Tobacco Smoke Exposure in the Third Trimester of Pregnancy Is Associated with Atopic Eczema/Dermatitis Syndrome in Infancy","Shinohara M, Matsumoto K.","Pediatr Allergy Immunol Pulmonol. 2017 Sep 1;30(3):155-162. doi: 10.1089/ped.2017.0758.","Shinohara M","Pediatr Allergy Immunol Pulmonol","2017","2017/10/25","PMC5649395","","10.1089/ped.2017.0758"
"23063509","Altered decidual DC-SIGN+ antigen-presenting cells and impaired regulatory T-cell induction in preeclampsia","Hsu P, Santner-Nanan B, Dahlstrom JE, Fadia M, Chandra A, Peek M, Nanan R.","Am J Pathol. 2012 Dec;181(6):2149-60. doi: 10.1016/j.ajpath.2012.08.032. Epub 2012 Oct 9.","Hsu P","Am J Pathol","2012","2012/10/16","","","10.1016/j.ajpath.2012.08.032"
"25532738","Relationship between prenatal antibiotic use and asthma in at-risk children","Lapin B, Piorkowski J, Ownby D, Freels S, Chavez N, Hernandez E, Wagner-Cassanova C, Pelzel D, Vergara C, Persky V.","Ann Allergy Asthma Immunol. 2015 Mar;114(3):203-7. doi: 10.1016/j.anai.2014.11.014. Epub 2014 Dec 19.","Lapin B","Ann Allergy Asthma Immunol","2015","2014/12/24","PMC4352392","NIHMS645379","10.1016/j.anai.2014.11.014"
"28978515","Late-gestation maternal dietary methyl donor and cofactor supplementation in sheep partially reverses protection against allergic sensitization by IUGR","Wooldridge AL, Bischof RJ, Liu H, Heinemann GK, Hunter DS, Giles LC, Simmons RA, Lien YC, Lu W, Rabinowitz JD, Kind KL, Owens JA, Clifton VL, Gatford KL.","Am J Physiol Regul Integr Comp Physiol. 2018 Jan 1;314(1):R22-R33. doi: 10.1152/ajpregu.00549.2016. Epub 2017 Oct 4.","Wooldridge AL","Am J Physiol Regul Integr Comp Physiol","2018","2017/10/06","PMC5866368","","10.1152/ajpregu.00549.2016"
"31959270","Intra-uterine growth restriction induced by maternal low-protein diet causes long-term alterations of thymic structure and function in adult male rat offspring","Armengaud JB, Dennebouy Z, Labes D, Fumey C, Wilson A, Candotti F, Yzydorczyk C, Simeoni U.","Br J Nutr. 2020 Apr 28;123(8):892-900. doi: 10.1017/S000711452000015X. Epub 2020 Jan 21.","Armengaud JB","Br J Nutr","2020","2020/01/22","","","10.1017/S000711452000015X"
"27553765","Metabolic and immunologic aspects of fetoplacental insufficiency","Bekmukhambetov Y, Mamyrbayev A, Dzharkenov T, Kravtsova N, Utesheva Z, Tusupkaliev A, Ryzhkova S, Darzhanova K, Bekzhanova M.","Am J Reprod Immunol. 2016 Oct;76(4):299-306. doi: 10.1111/aji.12544. Epub 2016 Aug 24.","Bekmukhambetov Y","Am J Reprod Immunol","2016","2016/08/25","","","10.1111/aji.12544"
"26827836","Immunologic progression of canine leishmaniosis following vertical transmission in United States dogs","Vida B, Toepp A, Schaut RG, Esch KJ, Juelsgaard R, Shimak RM, Petersen CA.","Vet Immunol Immunopathol. 2016 Jan;169:34-8. doi: 10.1016/j.vetimm.2015.11.008. Epub 2015 Dec 2.","Vida B","Vet Immunol Immunopathol","2016","2016/02/02","PMC4799997","NIHMS745485","10.1016/j.vetimm.2015.11.008"
"24489864","Effects of parental omega-3 fatty acid intake on offspring microbiome and immunity","Myles IA, Pincus NB, Fontecilla NM, Datta SK.","PLoS One. 2014 Jan 29;9(1):e87181. doi: 10.1371/journal.pone.0087181. eCollection 2014.","Myles IA","PLoS One","2014","2014/02/04","PMC3906117","","10.1371/journal.pone.0087181"
"22846753","Prenatal and early-life exposures alter expression of innate immunity genes: the PASTURE cohort study","Loss G, Bitter S, Wohlgensinger J, Frei R, Roduit C, Genuneit J, Pekkanen J, Roponen M, Hirvonen MR, Dalphin JC, Dalphin ML, Riedler J, von Mutius E, Weber J, Kabesch M, Michel S, Braun-Fahrländer C, Lauener R; PASTURE study group.","J Allergy Clin Immunol. 2012 Aug;130(2):523-30.e9. doi: 10.1016/j.jaci.2012.05.049.","Loss G","J Allergy Clin Immunol","2012","2012/08/01","","","10.1016/j.jaci.2012.05.049"
"28114741","Loss of the transforming growth factor-β effector β2-Spectrin promotes genomic instability","Chen J, Shukla V, Farci P, Andricovich J, Jogunoori W, Kwong LN, Katz LH, Shetty K, Rashid A, Su X, White J, Li L, Wang AY, Blechacz B, Raju GS, Davila M, Nguyen BN, Stroehlein JR, Chen J, Kim SS, Levin H, Machida K, Tsukamoto H, Michaely P, Tzatsos A, Mishra B, Amdur R, Mishra L.","Hepatology. 2017 Feb;65(2):678-693. doi: 10.1002/hep.28927. Epub 2016 Dec 24.","Chen J","Hepatology","2017","2017/01/24","PMC5432427","NIHMS869336","10.1002/hep.28927"
"22675563","Developmental exposure to bisphenol A modulates innate but not adaptive immune responses to influenza A virus infection","Roy A, Bauer SM, Lawrence BP.","PLoS One. 2012;7(6):e38448. doi: 10.1371/journal.pone.0038448. Epub 2012 Jun 4.","Roy A","PLoS One","2012","2012/06/08","PMC3366985","","10.1371/journal.pone.0038448"
"26571221","Prenatal exposure to bisphenol-A is associated with Toll-like receptor-induced cytokine suppression in neonates","Liao SL, Tsai MH, Lai SH, Yao TC, Hua MC, Yeh KW, Chiang CH, Huang SY, Huang JL.","Pediatr Res. 2016 Mar;79(3):438-44. doi: 10.1038/pr.2015.234. Epub 2015 Nov 16.","Liao SL","Pediatr Res","2016","2015/11/17","","","10.1038/pr.2015.234"
"23350954","Pre-natal exposure to perfluoroalkyl substances may be associated with altered vaccine antibody levels and immune-related health outcomes in early childhood","Granum B, Haug LS, Namork E, Stølevik SB, Thomsen C, Aaberge IS, van Loveren H, Løvik M, Nygaard UC.","J Immunotoxicol. 2013 Oct-Dec;10(4):373-9. doi: 10.3109/1547691X.2012.755580. Epub 2013 Jan 25.","Granum B","J Immunotoxicol","2013","2013/01/29","","","10.3109/1547691X.2012.755580"
"30540846","Evaluating the impact of meloxicam oral suspension administered at parturition on subsequent production, health, and culling in dairy cows: A randomized clinical field trial","Shock DA, Renaud DL, Roche SM, Poliquin R, Thomson R, Olson ME.","PLoS One. 2018 Dec 12;13(12):e0209236. doi: 10.1371/journal.pone.0209236. eCollection 2018.","Shock DA","PLoS One","2018","2018/12/13","PMC6291144","","10.1371/journal.pone.0209236"
"29718478","Developmental Exposure to a Mixture of 23 Chemicals Associated With Unconventional Oil and Gas Operations Alters the Immune System of Mice","Boulé LA, Chapman TJ, Hillman SE, Kassotis CD, O'Dell C, Robert J, Georas SN, Nagel SC, Lawrence BP.","Toxicol Sci. 2018 Jun 1;163(2):639-654. doi: 10.1093/toxsci/kfy066.","Boulé LA","Toxicol Sci","2018","2018/05/03","PMC5974794","","10.1093/toxsci/kfy066"
"23637733","Altered response to A(H1N1)pnd09 vaccination in pregnant women: a single blinded randomized controlled trial","Bischoff AL, Følsgaard NV, Carson CG, Stokholm J, Pedersen L, Holmberg M, Bisgaard A, Birch S, Tsai TF, Bisgaard H.","PLoS One. 2013 Apr 18;8(4):e56700. doi: 10.1371/journal.pone.0056700. Print 2013.","Bischoff AL","PLoS One","2013","2013/05/03","PMC3630160","","10.1371/journal.pone.0056700"
"26023231","The effect of prenatal maternal infection on respiratory function in mouse offspring: evidence for enhanced chemosensitivity","Samarasinghe TD, Sands SA, Skuza EM, Joshi MS, Nold-Petry CA, Berger PJ.","J Appl Physiol (1985). 2015 Aug 1;119(3):299-307. doi: 10.1152/japplphysiol.01105.2014. Epub 2015 May 28.","Samarasinghe TD","J Appl Physiol (1985)","2015","2015/05/30","","","10.1152/japplphysiol.01105.2014"
"24489577","The role of cytokines in the functional activity of phagocytes in blood and colostrum of diabetic mothers","Fagundes DL, França EL, Morceli G, Rudge MV, Calderon Ide M, Honorio-França AC.","Clin Dev Immunol. 2013;2013:590190. doi: 10.1155/2013/590190. Epub 2013 Dec 17.","Fagundes DL","Clin Dev Immunol","2013","2014/02/04","PMC3877604","","10.1155/2013/590190"
"28329160","Maternal Microchimerism Predicts Increased Infection but Decreased Disease due to Plasmodium falciparum During Early Childhood","Harrington WE, Kanaan SB, Muehlenbachs A, Morrison R, Stevenson P, Fried M, Duffy PE, Nelson JL.","J Infect Dis. 2017 May 1;215(9):1445-1451. doi: 10.1093/infdis/jix129.","Harrington WE","J Infect Dis","2017","2017/03/23","PMC5790147","","10.1093/infdis/jix129"
"30574152","A Functionally Different Immune Phenotype in Cattle Is Associated With Higher Mastitis Incidence","Lutterberg K, Kleinwort KJH, Hobmaier BF, Hauck SM, Nüske S, Scholz AM, Deeg CA.","Front Immunol. 2018 Dec 6;9:2884. doi: 10.3389/fimmu.2018.02884. eCollection 2018.","Lutterberg K","Front Immunol","2018","2018/12/22","PMC6291514","","10.3389/fimmu.2018.02884"
"27151935","Threatened preterm labour - analysis of the cytokine profile and progesterone treatment efficiency","Chmaj-Wierzchowska K, Olejniczak T, Tuzel J, Niepsuj-Biniaś J, Kaczorowska I, Samara H, Budna J, Dera-Szymanowska A, Olejniczak K, Szymanowski K.","J Matern Fetal Neonatal Med. 2017 Apr;30(7):814-817. doi: 10.1080/14767058.2016.1186638. Epub 2016 Jun 3.","Chmaj-Wierzchowska K","J Matern Fetal Neonatal Med","2017","2016/05/07","","","10.1080/14767058.2016.1186638"
"27725661","Adenosine A(2A) receptor regulation of microglia morphological remodeling-gender bias in physiology and in a model of chronic anxiety","Caetano L, Pinheiro H, Patrício P, Mateus-Pinheiro A, Alves ND, Coimbra B, Baptista FI, Henriques SN, Cunha C, Santos AR, Ferreira SG, Sardinha VM, Oliveira JF, Ambrósio AF, Sousa N, Cunha RA, Rodrigues AJ, Pinto L, Gomes CA.","Mol Psychiatry. 2017 Jul;22(7):1035-1043. doi: 10.1038/mp.2016.173. Epub 2016 Oct 11.","Caetano L","Mol Psychiatry","2017","2016/10/12","","","10.1038/mp.2016.173"
"29221591","Eradicating BVD, reviewing Irish programme data and model predictions to support prospective decision making","Thulke HH, Lange M, Tratalos JA, Clegg TA, McGrath G, O'Grady L, O'Sullivan P, Doherty ML, Graham DA, More SJ.","Prev Vet Med. 2018 Feb 1;150:151-161. doi: 10.1016/j.prevetmed.2017.11.017. Epub 2017 Nov 23.","Thulke HH","Prev Vet Med","2018","2017/12/10","","","10.1016/j.prevetmed.2017.11.017"
"26778384","Elevated concentration of secretory leukocyte protease inhibitor in the cervical mucus before delivery","Samejima T, Nagamatsu T, Schust DJ, Itaoka N, Iriyama T, Nakayama T, Komatsu A, Kawana K, Osuga Y, Fujii T.","Am J Obstet Gynecol. 2016 Jun;214(6):741.e1-7. doi: 10.1016/j.ajog.2015.12.029. Epub 2016 Jan 14.","Samejima T","Am J Obstet Gynecol","2016","2016/01/19","","","10.1016/j.ajog.2015.12.029"
"25858482","Maternal obesity alters immune cell frequencies and responses in umbilical cord blood samples","Wilson RM, Marshall NE, Jeske DR, Purnell JQ, Thornburg K, Messaoudi I.","Pediatr Allergy Immunol. 2015 Jun;26(4):344-51. doi: 10.1111/pai.12387.","Wilson RM","Pediatr Allergy Immunol","2015","2015/04/11","PMC9271931","NIHMS1724588","10.1111/pai.12387"
"35777461","Perinatal arsenic exposure-induced sustained microglial activation leads to impaired cognitive response in BALB/c mice","Ansari JA, Dey RK, Mishra SK, Roy O, Kushwaha S, Singh V, Patnaik S, Ghosh D.","Neurotoxicology. 2022 Sep;92:1-14. doi: 10.1016/j.neuro.2022.06.009. Epub 2022 Jun 28.","Ansari JA","Neurotoxicology","2022","2022/07/01","","","10.1016/j.neuro.2022.06.009"
"32170117","Intrauterine growth restriction in piglets alters blood cell counts and impairs cytokine responses in peripheral mononuclear cells 24 days post-partum","Amdi C, Lynegaard JC, Thymann T, Williams AR.","Sci Rep. 2020 Mar 13;10(1):4683. doi: 10.1038/s41598-020-61623-w.","Amdi C","Sci Rep","2020","2020/03/15","PMC7069946","","10.1038/s41598-020-61623-w"
"29791872","Gene expression in cord blood links genetic risk for neurodevelopmental disorders with maternal psychological distress and adverse childhood outcomes","Breen MS, Wingo AP, Koen N, Donald KA, Nicol M, Zar HJ, Ressler KJ, Buxbaum JD, Stein DJ.","Brain Behav Immun. 2018 Oct;73:320-330. doi: 10.1016/j.bbi.2018.05.016. Epub 2018 May 20.","Breen MS","Brain Behav Immun","2018","2018/05/24","PMC6191930","","10.1016/j.bbi.2018.05.016"
"31590936","Immune memory induced by intranasal vaccination with a modified-live viral vaccine delivered to colostrum fed neonatal calves","Hill K, Arsic N, Nordstrom S, Griebel PJ.","Vaccine. 2019 Dec 3;37(51):7455-7462. doi: 10.1016/j.vaccine.2019.09.080. Epub 2019 Oct 4.","Hill K","Vaccine","2019","2019/10/09","","","10.1016/j.vaccine.2019.09.080"
"22767056","Stress-related programming of autonomic imbalance: role in allergy and asthma","Wright RJ.","Chem Immunol Allergy. 2012;98:32-47. doi: 10.1159/000336496. Epub 2012 Jun 26.","Wright RJ","Chem Immunol Allergy","2012","2012/07/07","PMC3888825","NIHMS525911","10.1159/000336496"
"25347678","Prenatal polycyclic aromatic hydrocarbon, adiposity, peroxisome proliferator-activated receptor (PPAR) γ methylation in offspring, grand-offspring mice","Yan Z, Zhang H, Maher C, Arteaga-Solis E, Champagne FA, Wu L, McDonald JD, Yan B, Schwartz GJ, Miller RL.","PLoS One. 2014 Oct 27;9(10):e110706. doi: 10.1371/journal.pone.0110706. eCollection 2014.","Yan Z","PLoS One","2014","2014/10/28","PMC4210202","","10.1371/journal.pone.0110706"
"29614902","Intravenous immunoglobulin (IVIG) efficiency in women with common variable immunodeficiency (CVID) decreases significantly during pregnancy","Egawa M, Kanegane H, Imai K, Morio T, Miyasaka N.","J Matern Fetal Neonatal Med. 2019 Sep;32(18):3092-3096. doi: 10.1080/14767058.2018.1455824. Epub 2018 Apr 3.","Egawa M","J Matern Fetal Neonatal Med","2019","2018/04/05","","","10.1080/14767058.2018.1455824"
"24183682","From goat colostrum to milk: physical, chemical, and immune evolution from partum to 90 days postpartum","Sánchez-Macías D, Moreno-Indias I, Castro N, Morales-Delanuez A, Argüello A.","J Dairy Sci. 2014;97(1):10-6. doi: 10.3168/jds.2013-6811. Epub 2013 Nov 1.","Sánchez-Macías D","J Dairy Sci","2014","2013/11/05","","","10.3168/jds.2013-6811"
"29692868","Epigenome-wide association study of total serum immunoglobulin E in children: a life course approach","Peng C, Cardenas A, Rifas-Shiman SL, Hivert MF, Gold DR, Platts-Mills TA, Lin X, Oken E, Baccarelli AA, Litonjua AA, DeMeo DL.","Clin Epigenetics. 2018 Apr 17;10:55. doi: 10.1186/s13148-018-0488-x. eCollection 2018.","Peng C","Clin Epigenetics","2018","2018/04/26","PMC5905182","","10.1186/s13148-018-0488-x"
"23414538","Methylation of IL-2 promoter at birth alters the risk of asthma exacerbations during childhood","Curtin JA, Simpson A, Belgrave D, Semic-Jusufagic A, Custovic A, Martinez FD.","Clin Exp Allergy. 2013 Mar;43(3):304-11. doi: 10.1111/cea.12046.","Curtin JA","Clin Exp Allergy","2013","2013/02/19","PMC6344940","NIHMS774249","10.1111/cea.12046"
"26442233","In utero Head Circumference is Associated with Childhood Allergy","Eviston DP, Minasyan A, Mann KP, Campbell DE, Nanan RK.","Front Pediatr. 2015 Sep 8;3:73. doi: 10.3389/fped.2015.00073. eCollection 2015.","Eviston DP","Front Pediatr","2015","2015/10/07","PMC4561811","","10.3389/fped.2015.00073"
"25913185","Early exposure to intermediate-frequency magnetic fields alters brain biomarkers without histopathological changes in adult mice","Win-Shwe TT, Ohtani S, Ushiyama A, Kunugita N.","Int J Environ Res Public Health. 2015 Apr 22;12(4):4406-21. doi: 10.3390/ijerph120404406.","Win-Shwe TT","Int J Environ Res Public Health","2015","2015/04/28","PMC4410255","","10.3390/ijerph120404406"
"32279324","The effects of advanced maternal age on T-cell subsets at the maternal-fetal interface prior to term labor and in the offspring: a mouse study","Levenson D, Romero R, Garcia-Flores V, Miller D, Xu Y, Sahi A, Hassan SS, Gomez-Lopez N.","Clin Exp Immunol. 2020 Jul;201(1):58-75. doi: 10.1111/cei.13437. Epub 2020 May 7.","Levenson D","Clin Exp Immunol","2020","2020/04/13","PMC7290081","","10.1111/cei.13437"
"33107565","Newly characterized decidual Tim-3+ Treg cells are abundant during early pregnancy and driven by IL-27 coordinately with Gal-9 from trophoblasts","Hu X, Zhu Q, Wang Y, Wang L, Li Z, Mor G, Liao A.","Hum Reprod. 2020 Nov 1;35(11):2454-2466. doi: 10.1093/humrep/deaa223.","Hu X","Hum Reprod","2020","2020/10/27","PMC8463095","","10.1093/humrep/deaa223"
"31131784","Maternal folic acid depletion during early pregnancy increases sensitivity to squamous tumor formation in the offspring in mice","Kawakubo-Yasukochi T, Morioka M, Ohe K, Yasukochi A, Ozaki Y, Hazekawa M, Nishinakagawa T, Ono K, Nakamura S, Nakashima M.","J Dev Orig Health Dis. 2019 Dec;10(6):683-691. doi: 10.1017/S2040174419000217. Epub 2019 May 27.","Kawakubo-Yasukochi T","J Dev Orig Health Dis","2019","2019/05/28","","","10.1017/S2040174419000217"
"25177073","Universal combination antiretroviral regimens to prevent mother-to-child transmission of HIV in rural Zambia: a two-round cross-sectional study","Chi BH, Musonda P, Lembalemba MK, Chintu NT, Gartland MG, Mulenga SN, Bweupe M, Turnbull E, Stringer EM, Stringer JS.","Bull World Health Organ. 2014 Aug 1;92(8):582-92. doi: 10.2471/BLT.13.129833. Epub 2014 Jun 5.","Chi BH","Bull World Health Organ","2014","2014/09/02","PMC4147407","","10.2471/BLT.13.129833"
"28632934","A prospective microbiome-wide association study of food sensitization and food allergy in early childhood","Savage JH, Lee-Sarwar KA, Sordillo J, Bunyavanich S, Zhou Y, O'Connor G, Sandel M, Bacharier LB, Zeiger R, Sodergren E, Weinstock GM, Gold DR, Weiss ST, Litonjua AA.","Allergy. 2018 Jan;73(1):145-152. doi: 10.1111/all.13232. Epub 2017 Aug 2.","Savage JH","Allergy","2018","2017/06/21","PMC5921051","NIHMS958479","10.1111/all.13232"
"27832763","A comparison of intestinal microbiota in a population of low-risk infants exposed and not exposed to intrapartum antibiotics: The Baby & Microbiota of the Intestine cohort study protocol","Simioni J, Hutton EK, Gunn E, Holloway AC, Stearns JC, McDonald H, Mousseau A, Schertzer JD, Ratcliffe EM, Thabane L, Surette MG, Morrison KM.","BMC Pediatr. 2016 Nov 10;16(1):183. doi: 10.1186/s12887-016-0724-5.","Simioni J","BMC Pediatr","2016","2016/11/12","PMC5103394","","10.1186/s12887-016-0724-5"
"35312156","Tenofovir disoproxil fumarate therapy to prevent hepatitis B virus vertical transmission-A review of maternal and infant outcomes","Samadi Kochaksaraei G, Shaheen AA, Seow CH, Barkema HW, Coffin CS.","Liver Int. 2022 Aug;42(8):1712-1730. doi: 10.1111/liv.15249. Epub 2022 Mar 31.","Samadi Kochaksaraei G","Liver Int","2022","2022/03/21","","","10.1111/liv.15249"
"31090436","In utero tobacco smoke exposure alters lung inflammation, viral clearance, and CD8(+) T-cell responses in neonatal mice infected with respiratory syncytial virus","Cheemarla NR, Uche IK, McBride K, Naidu S, Guerrero-Plata A.","Am J Physiol Lung Cell Mol Physiol. 2019 Aug 1;317(2):L212-L221. doi: 10.1152/ajplung.00338.2018. Epub 2019 May 15.","Cheemarla NR","Am J Physiol Lung Cell Mol Physiol","2019","2019/05/16","","","10.1152/ajplung.00338.2018"
"35560014","A combination of immune cell types identified through ensemble machine learning strategy detects altered profile in recurrent pregnancy loss: a pilot study","Benner M, Feyaerts D, Lopez-Rincon A, van der Heijden OWH, van der Hoorn ML, Joosten I, Ferwerda G, van der Molen RG.","F S Sci. 2022 May;3(2):166-173. doi: 10.1016/j.xfss.2022.02.002. Epub 2022 Feb 9.","Benner M","F S Sci","2022","2022/05/13","","","10.1016/j.xfss.2022.02.002"
"25027824","Arginase I levels are decreased in the plasma of pediatric patients with atopic dermatitis","Dimitriades V, Rodriguez PC, Zabaleta J, Ochoa AC.","Ann Allergy Asthma Immunol. 2014 Sep;113(3):271-5. doi: 10.1016/j.anai.2014.06.010. Epub 2014 Jul 11.","Dimitriades V","Ann Allergy Asthma Immunol","2014","2014/07/17","PMC4517580","NIHMS616647","10.1016/j.anai.2014.06.010"
"25874544","Determinants of vaccine immunogenicity in HIV-infected pregnant women: analysis of B and T cell responses to pandemic H1N1 monovalent vaccine","Weinberg A, Muresan P, Richardson KM, Fenton T, Dominguez T, Bloom A, Watts DH, Abzug MJ, Nachman SA, Levin MJ; P1086 team.","PLoS One. 2015 Apr 13;10(4):e0122431. doi: 10.1371/journal.pone.0122431. eCollection 2015.","Weinberg A","PLoS One","2015","2015/04/16","PMC4395240","","10.1371/journal.pone.0122431"
"24341549","Maternal circulating dendritic cell subtypes at delivery and during the 1-year postpartum period","Lee HR, Kim BJ, Shin S, Jeon HW, Roh EY, Yoon JH, Song EY.","Am J Reprod Immunol. 2014 Mar;71(3):210-6. doi: 10.1111/aji.12188. Epub 2013 Dec 16.","Lee HR","Am J Reprod Immunol","2014","2013/12/18","","","10.1111/aji.12188"
"27465646","Long-term follow-up of HIV seroconverters in microbicide trials - rationale, study design, and challenges in MTN-015","Riddler SA, Husnik M, Gorbach PM, Levy L, Parikh U, Livant E, Pather A, Makanani B, Muhlanga F, Kasaro M, Martinson F, Elharrar V, Balkus JE; MTN-015 Protocol Team for the Microbicide Trials Network.","HIV Clin Trials. 2016 Sep;17(5):204-11. doi: 10.1080/15284336.2016.1212561. Epub 2016 Jul 28.","Riddler SA","HIV Clin Trials","2016","2016/07/29","PMC5002236","NIHMS807019","10.1080/15284336.2016.1212561"
"30575222","Effects of an immunomodulatory feed additive on body weight, production parameters, blood metabolites, and health in multiparous transition Holstein cows","Wu Z, Alugongo GM, Xiao J, Li J, Yu Y, Li Y, Wang Y, Li S, Cao Z.","Anim Sci J. 2019 Feb;90(2):167-177. doi: 10.1111/asj.13066. Epub 2018 Dec 21.","Wu Z","Anim Sci J","2019","2018/12/22","","","10.1111/asj.13066"
"30929287","Maternal IgG impairs the maturation of offspring intrathymic IL-17-producing γδT cells: Implications for murine and human allergies","de-Oliveira MG, Lira AAL, Sgnotto FR, Inoue AHS, Santos LS, Nakamatsu BY, Duarte AJS, Leite-de-Moraes M, Victor JR.","Clin Exp Allergy. 2019 Jul;49(7):1000-1012. doi: 10.1111/cea.13393. Epub 2019 Apr 14.","de-Oliveira MG","Clin Exp Allergy","2019","2019/04/01","","","10.1111/cea.13393"
"26228390","Study protocol for a randomised controlled trial evaluating the efficacy of a telehealth program--management of asthma with supportive telehealth of respiratory function in pregnancy (MASTERY©)","Zairina E, Abramson MJ, McDonald CF, Li J, Dharmasiri T, Stewart K, Walker SP, Paul E, George J.","BMC Pulm Med. 2015 Jul 31;15:84. doi: 10.1186/s12890-015-0082-3.","Zairina E","BMC Pulm Med","2015","2015/08/01","PMC4521452","","10.1186/s12890-015-0082-3"
